A’s hitters no match for Cubs’ pitching phenom Shota Imanaga,Jon Becker,"Fri, 15 Mar 2024 01:51:11 +0000"
"Third period dooms Sharks, again, but veteran forward avoids serious injury",Curtis Pashelka,"Fri, 15 Mar 2024 01:41:55 +0000"
"Eight injured when SUV runs red light, hits Tri Delta Transit bus in Antioch",Jason Green,"Fri, 15 Mar 2024 01:21:37 +0000"
"Alameda County could take another month to determine if Pamela Price recall has enough signatures, registrar says",Shomik Mukherjee,"Fri, 15 Mar 2024 01:20:30 +0000"
Major storm inundates Colorado with feet of snow,The Associated Press,"Fri, 15 Mar 2024 00:16:07 +0000"
Lawsuit: Emery Unified officials failed to protect student from sexual abuse,Sierra Lopez,"Thu, 14 Mar 2024 23:49:22 +0000"
Trump-backed Senate candidate faces GOP worries that he could be linked to adult website profile,Associated Press,"Thu, 14 Mar 2024 23:47:48 +0000"
James Crumbley found guilty in his son’s school shooting,The Associated Press,"Thu, 14 Mar 2024 23:37:17 +0000"
Letters: Lee’s legacy | Let go of landlines | Support for teachers | Calling out Trump | Firing employees,Letters To The Editor,"Thu, 14 Mar 2024 23:30:26 +0000"
Russia reports Ukraine has fired missiles at a border region,The Associated Press,"Thu, 14 Mar 2024 23:25:47 +0000"
